{
  "entry_id": "uuid-4004",
  "ts": "2025-08-29T10:15:00Z",
  "type": "escalation_event",
  "ref": null,
  "meta": {
    "escalation_event": {
      "source": "validator",
      "tier": 4,
      "action": "containment",
      "mode_profile": "strict",
      "details": "Hard schema failure triggered containment"
    }
  }
}

